[
 {
  "slug": "oisans",
  "name": "Oisans",
  "country": "FR",
  "center": {
   "lat": 45.08,
   "lon": 6.15
  },
  "radiusKm": 30,
  "baseTowns": [
   "bourg-d-oisans"
  ],
  "include": [],
  "exclude": [],
  "character": "Alpe d'Huez, Galibier, Croix de Fer und Sarenne auf einem Fleck: große Höhen, große Namen, und auf der D1091 durch die Romanche-Schlucht viel Verkehr.",
  "multiDay": "Basis für vier bis sechs Tage; die Marmotte-Runde an einem Tag, eine Etappe über den Galibier nach Briançon ist möglich.",
  "access": "Grenoble mit der Bahn, Flughafen Lyon in anderthalb Stunden; der Bus ins Tal fährt bis Bourg-d'Oisans."
 },
 {
  "slug": "maurienne",
  "name": "Maurienne",
  "country": "FR",
  "center": {
   "lat": 45.28,
   "lon": 6.4
  },
  "radiusKm": 25,
  "baseTowns": [
   "saint-jean-de-maurienne"
  ],
  "include": [],
  "exclude": [],
  "character": "Das Tal mit den meisten Anstiegen der Tour: Madeleine, Croix de Fer, Glandon, Télégraphe, Mollard, Chaussy mit den Lacets de Montvernier – alle beginnen im Talgrund.",
  "multiDay": "Eine Woche ohne Wiederholung; die Route des Grandes Alpes läuft mitten hindurch, und der Galibier verbindet nach Briançon.",
  "access": "Bahnhof Saint-Jean-de-Maurienne mit TGV-Halt; Autobahn A43 durchs Tal."
 },
 {
  "slug": "tarentaise",
  "name": "Tarentaise",
  "country": "FR",
  "center": {
   "lat": 45.58,
   "lon": 6.72
  },
  "radiusKm": 28,
  "baseTowns": [
   "bourg-saint-maurice"
  ],
  "include": [
   "col-de-l-iseran",
   "val-thorens"
  ],
  "exclude": [],
  "character": "Iseran, Petit Saint-Bernard, Cormet de Roselend und die Skistationen als Stichstraßen – hohe, lange Anstiege, spät im Jahr offen.",
  "multiDay": "Vier bis fünf Tage; der Iseran nach Bonneval und der Petit Saint-Bernard nach Aosta sind Etappen, keine Runden.",
  "access": "Bahnhof Bourg-Saint-Maurice, TGV im Winter, sonst über Chambéry."
 },
 {
  "slug": "brianconnais-queyras",
  "name": "Briançonnais und Queyras",
  "country": "FR",
  "center": {
   "lat": 44.85,
   "lon": 6.7
  },
  "radiusKm": 30,
  "baseTowns": [
   "briancon",
   "guillestre"
  ],
  "include": [],
  "exclude": [],
  "character": "Izoard, Granon, Agnel, Montgenèvre und die Schluchten des Guil: hoch, trocken, sonnig – Briançon liegt selbst auf 1 300 m.",
  "multiDay": "Eine Woche mit zwei Standorten; nach Italien über Agnel oder Montgenèvre, nach Süden über Vars in die Ubaye.",
  "access": "Bahnhof Briançon (Nachtzug aus Paris); Turin über den Fréjus-Tunnel oder Montgenèvre."
 },
 {
  "slug": "champsaur",
  "name": "Champsaur",
  "country": "FR",
  "center": {
   "lat": 44.66,
   "lon": 6.15
  },
  "radiusKm": 25,
  "baseTowns": [
   "gap"
  ],
  "include": [],
  "exclude": [],
  "character": "Das stille Hochtal nördlich von Gap: der Noyer als einziger großer Name, dazu Manse, Chaillol und Orcières, sonniger als die Écrins dahinter.",
  "multiDay": "Zwei bis drei Tage ab Gap, als Etappe zwischen Oisans und Ubaye.",
  "access": "Gap mit dem Zug aus Grenoble oder Marseille."
 },
 {
  "slug": "ubaye",
  "name": "Ubaye",
  "country": "FR",
  "center": {
   "lat": 44.4,
   "lon": 6.7
  },
  "radiusKm": 28,
  "baseTowns": [
   "barcelonnette"
  ],
  "include": [],
  "exclude": [],
  "character": "Bonette, Vars, Allos, Cayolle und Pra-Loup von einem stillen Tal aus – die größten Höhen der Alpen mit dem wenigsten Verkehr.",
  "multiDay": "Fünf Tage reichen nicht; die Bonette allein ist ein Tag, und die Runde über Allos und Cayolle ein zweiter.",
  "access": "Kein Bahnhof; Gap oder Digne mit der Bahn, dann Bus. Mit dem Auto über Gap oder aus Cuneo über den Col de Larche."
 },
 {
  "slug": "mercantour",
  "name": "Mercantour und Nizza",
  "country": "FR",
  "center": {
   "lat": 43.95,
   "lon": 7.25
  },
  "radiusKm": 35,
  "baseTowns": [
   "sospel",
   "nizza",
   "menton"
  ],
  "include": [],
  "exclude": [],
  "character": "Turini, Braus, Castillon, Vence und die Schluchten des Cians – vom Meer in die Berge, und im Winter das mildeste Rennradgebiet der Alpen.",
  "multiDay": "Oktober bis April der Ort für eine Woche; im Sommer früh starten, die Küstenstraßen sind heiß und voll.",
  "access": "Flughafen und Bahnhof Nizza; die Bahnlinie ins Roya-Tal hält in Sospel."
 },
 {
  "slug": "ventoux",
  "name": "Ventoux und Baronnies",
  "country": "FR",
  "center": {
   "lat": 44.2,
   "lon": 5.3
  },
  "radiusKm": 25,
  "baseTowns": [
   "bedoin",
   "malaucene",
   "vaison-la-romaine"
  ],
  "include": [],
  "exclude": [],
  "character": "Ein Berg mit drei Auffahrten und ringsum die kleinen Pässe der Baronnies und die Gorges de la Nesque: Lavendel, Kalk, Mistral.",
  "multiDay": "Drei Tage für die drei Seiten des Ventoux, der Rest für die Baronnies; im Hochsommer ist der Berg heiß und voll.",
  "access": "Avignon TGV, dann eine Stunde mit dem Auto; Orange über die Autobahn A7."
 },
 {
  "slug": "vercors",
  "name": "Vercors",
  "country": "FR",
  "center": {
   "lat": 45,
   "lon": 5.4
  },
  "radiusKm": 25,
  "baseTowns": [],
  "include": [],
  "exclude": [],
  "character": "Combe Laval, die Gorges de la Bourne und der Rousset: in die Wand gehauene Balkonstraßen statt Pässe, und oben ein stilles Plateau.",
  "multiDay": "Drei bis vier Tage Balkonstraßen und Hochebene; nach Grenoble oder Die als Etappe.",
  "access": "Grenoble oder Valence mit dem TGV, dann eine Stunde ins Plateau."
 },
 {
  "slug": "susa-piemont",
  "name": "Susatal und Piemont",
  "country": "IT",
  "center": {
   "lat": 45.05,
   "lon": 7
  },
  "radiusKm": 25,
  "baseTowns": [
   "susa"
  ],
  "include": [],
  "exclude": [],
  "character": "Finestre mit seinem Schotter, Sestriere, Mont Cenis und der Nivolet – die piemontesische Seite der Westalpen, Giro-Land.",
  "multiDay": "Vier Tage; über Montgenèvre oder Mont Cenis nach Frankreich als Etappe.",
  "access": "Bahnhof Susa über Turin; Turin in einer Stunde."
 },
 {
  "slug": "cuneo",
  "name": "Cuneo und die Alpi Marittime",
  "country": "IT",
  "center": {
   "lat": 44.45,
   "lon": 7.2
  },
  "radiusKm": 35,
  "baseTowns": [
   "cuneo"
  ],
  "include": [],
  "exclude": [],
  "character": "Fauniera, Sampeyre, Agnello, Lombarde und das Maira-Tal: die einsamsten hohen Straßen der Alpen, von einer Stadt mit Bahnhof aus.",
  "multiDay": "Eine Woche ohne Wiederholung; über die Lombarde nach Frankreich als Etappe.",
  "access": "Bahnhof Cuneo über Turin; Flughafen Turin in anderthalb Stunden."
 },
 {
  "slug": "aostatal",
  "name": "Aostatal",
  "country": "IT",
  "center": {
   "lat": 45.7,
   "lon": 7.2
  },
  "radiusKm": 30,
  "baseTowns": [
   "aosta"
  ],
  "include": [],
  "exclude": [],
  "character": "Großer und Kleiner Sankt Bernhard, San Carlo und die stillen Seitentäler Valsavarenche und Valgrisenche unter dem Gran Paradiso.",
  "multiDay": "Vier bis fünf Tage; die beiden Bernhard-Pässe verbinden nach Frankreich und in die Schweiz.",
  "access": "Bahnhof Aosta über Turin; Autobahn A5 von Turin."
 },
 {
  "slug": "monte-rosa",
  "name": "Monte-Rosa-Täler",
  "country": "IT",
  "center": {
   "lat": 45.78,
   "lon": 7.68
  },
  "radiusKm": 30,
  "baseTowns": [
   "saint-vincent"
  ],
  "include": [],
  "exclude": [],
  "character": "Breuil-Cervinia unter dem Matterhorn, der Col de Joux, das lange Gressoney-Tal und Oropa über Biella: Talanstiege von unten im Aostatal bis unter die Viertausender, ganzjährig bis oben offen.",
  "multiDay": "Drei bis vier Tage; mit Pila und Cogne im oberen Aostatal eine Woche, und der Große Sankt Bernhard führt ins Wallis.",
  "access": "Bahnhof Châtillon-Saint-Vincent an der Linie Turin–Aosta; Turin und Mailand in anderthalb bis zwei Stunden."
 },
 {
  "slug": "ligurien",
  "name": "Ligurische Riviera",
  "country": "IT",
  "center": {
   "lat": 43.95,
   "lon": 7.95
  },
  "radiusKm": 30,
  "baseTowns": [
   "sanremo",
   "imperia",
   "alassio"
  ],
  "include": [
   "colle-del-melogno"
  ],
  "exclude": [],
  "character": "Poggio, Cipressa und das Hinterland von Sanremo: niedrige Pässe, das ganze Jahr fahrbar, im Winter das Trainingslager der Profis.",
  "multiDay": "Eine Woche im Winterhalbjahr; im Sommer die Küste meiden und früh ins Hinterland.",
  "access": "Bahnhof Sanremo und Imperia auf der Küstenlinie; Flughafen Nizza in einer Stunde."
 },
 {
  "slug": "wallis",
  "name": "Wallis",
  "country": "CH",
  "center": {
   "lat": 46.25,
   "lon": 7.5
  },
  "radiusKm": 40,
  "baseTowns": [
   "martigny",
   "brig",
   "sion"
  ],
  "include": [
   "simplonpass",
   "nufenenpass",
   "col-des-montets",
   "col-de-la-forclaz-martigny",
   "col-du-grand-saint-bernard",
   "barrage-d-emosson"
  ],
  "exclude": [],
  "character": "Grand-Saint-Bernard, Forclaz, Sanetsch, Simplon und Nufenen vom tiefen Rhonetal aus – lange Anstiege, trockenes Klima, das Tal selbst warm.",
  "multiDay": "Eine Woche mit zwei Standorten; der Simplon nach Italien und der Nufenen ins Tessin als Etappen.",
  "access": "Bahnhöfe Martigny und Brig auf der Simplonlinie; Genf in anderthalb Stunden."
 },
 {
  "slug": "ossola",
  "name": "Ossola",
  "country": "IT",
  "center": {
   "lat": 46.12,
   "lon": 8.29
  },
  "radiusKm": 30,
  "baseTowns": [
   "domodossola"
  ],
  "include": [
   "macugnaga",
   "riale"
  ],
  "exclude": [],
  "character": "Die Südseite des Simplon, Macugnaga unter der Monte-Rosa-Ostwand und das Val Formazza bis zum Toce-Wasserfall: lange, mäßig steile Täler von einem tiefen, warmen Talboden aus.",
  "multiDay": "Drei Tage; der Simplon verbindet ins Wallis, der Lago Maggiore mit dem Mottarone liegt eine halbe Stunde südlich.",
  "access": "Bahnhof Domodossola an der Simplonlinie, direkt aus Brig, Genf, Bern und Mailand."
 },
 {
  "slug": "andermatt",
  "name": "Andermatt und Urserental",
  "country": "CH",
  "center": {
   "lat": 46.63,
   "lon": 8.5
  },
  "radiusKm": 30,
  "baseTowns": [
   "andermatt",
   "meiringen"
  ],
  "include": [],
  "exclude": [],